pk,jsondata,id,name,description,markup_description,date,version
1,"{""fd_age"": ""An attempt has been made to estimate the age of each word. In the case of words that are unlikely to have been borrowed, the level to which a word can be reconstructed provides a hypotheses for its estimated minimum age. Lexical reconstructions and dates for the three proto-languages follow Nurse and Hinnebusch 1993. No further claims are made about intermediate branches between proto-North-Eeat-Coast and proto-Bantu. Non-borrowed words for which we have no reconstructions are all assigned to the \u201cpre-modern\u201d Swahili period.\n\nearlier Bantu\t-3000 \u2013 1 CE\n\nproto-North-East-Coast\t1 \u2013 500\n\nproto-Sabaki\t500 \u2013 700\n\nproto-Swahili\t700 \u2013 800\n\npre-modern Swahili\t800 \u2013 1940\n\nThe database contains almost no probable loanwords for the reconstructed stages, but loans form a large group of lexical innovations at later stages. The age of words and phrases for which we have no reconstructions and that are not identified as probable loans has been classified as \u201cno information\u201d.\n\nThe remaining age categories are:\n\n1500 \u2013 1700\tloans from Portuguese\n\n1800 \u2013 1940\tmainly loans from English\n\n1940 \u2013 2000\tmainly loans from English\n\nThe year 1940 is a convenient cut-off date since two leading Swahili dictionaries were published in 1939 (Sacleux and Johnson)."", ""fd_borrowed"": ""In the great majority of cases, the identification of loanwords and donor languages follows the existing literature on the subject. However, the credibility of proposed etymologies varies a lot, and this is reflected in the scalar values in the field \u201cBorrowed status\"". The assignment of these values is admittedly subjective, but I have tried to be bold and minimize the intermediate values 2 and 3.\n\n0.\tNo evidence for borrowing:\nNo serious borrowing etymology is known to have been proposed.\n\n1.\tVery little evidence for borrowing:\nA proposed etymology is judged to lack credibility.\n\n2.\tPerhaps borrowed:\nThe item may or may not be a loan; the particular proposed etymology is rather doubtful.\n\n3.\tProbably borrowed:\nThe item is very likely a loan, but the proposed etymology is not fully convincing.\n\n4.\tClearly borrowed:\nThere is strong evidence that the item is a loan, generally including a good foreign etymology.\n\nI could have boosted the number of category 2 and 3 items by applying a strict \u201cregular phonology\u201d strategy, by which every item that does not in all details adhere to assumed historical sound changes and thus cannot in a fully regular way be derived  from Proto-Bantu is considered to be a loan. I have not chosen this (admittedly interesting) path for several reasons. One is that most of the existing literature on the loan component of Swahili lexis is exclusively concerned with non-Bantu donor languages. Secondly, I am not certain that all sound changes have been applied to all lexical items in a regular fashion (e.g., *l-deletion). Finally, Standard Swahili and its base Kiunguja is a rather complex blend straddling the major north-south divide of Swahili dialects \u2014 which makes it difficult to decide what is \u201cnative\u201d and what is not."", ""fd_hungarian_translation"": null, ""fd_reference"": ""All Swahili data comes from published sources, though in some cases speakers have been consulted to clarify finer points of semantics and actual usage. Bibliographical references to Swahili dictionaries (in the references field and in the Other Comments field) refer mainly to hypotheses about the etymology of particular words.\n\nBeaujard, Philippe. 1998. Dictionnaire malgache (dialectal)-fran\u00e7ais : dialecte ta\u00f1ala, sud-est de Madagascar, avec recherches \u00e9tymologiques. Paris: L\u2019Harmattan.\n\nBesha, Ruth M. 1993. A classified vocabulary of the Shambala language with outline grammar. (Bantu Vocabulary Series, 10.) Tokyo: Institute for the Study of Languages and Cultures of Asia and Africa (ILCAA).\n\nBrauner, Siegmund. 1986. Zum Verh\u00e4ltnis von Kultur- und Sprachgeschichte: Chinesische Lehnw\u00f6rter im Swahili. Zeitschrift f\u00fcr Phonetik, Sprachwissenschaft und Kommunikationsforschung 89:595-601.\n\nDozy, Reinhart P. A. 1881. Suppl\u00e9ment aux dictionnaires arabes. Leiden: E. J. Brill.\n\nGrosset-Grange, Henri; texte \u00e9tabli par Alain Rouaud. 1993. Glossaire nautique arabe ancien et moderne de l\u2019Oc\u00e9an Indien. Paris: \u00c9ditions du C.T.H.S.\n\nH\u00f6ftmann, Hildegard, and Irmtraud Herms. 1979. W\u00f6rterbuch Swahili-Deutsch. Leipzig: Verlag Enzyklop\u00e4die.\n\nH\u00f6ftmann, Hildegard. 1963. Suaheli-Deutsches W\u00f6rterbuch. Leipzig: Verlag Enzyklop\u00e4die.\n\nHoles, Clive. 2001. Dialect, culture, and society in Eastern Arabia. Vol. 1: Glossary. Leiden: Brill.\n\nJohnson, Frederick. 1939. A standard Swahili-English dictionary. Oxford University Press.\n\nKazimirski, A. de Biberstein. 1860. Dictionnaire arabe-fran\u00e7ais, contenant toutes les racines de la langue arabe, leurs d\u00e9riv\u00e9s, tant dans l\u2019idiome vulgaire que dans l\u2019idiome litt\u00e9ral, ainsi que les dialectes d\u2019Alger et de Maroc. 2 vols. Paris: Maisonneuve.\n\nKirkeby, Willy A. 2000. English-Swahili dictionary. Skedsmokorset: Kirkeby Forlag; Dar es Salaam: Kakapela (2001).\n\nKisbey, Wa. A. 1906. Zigula-English dictionary. London: Society for Promoting Christian Knowledge.\n\nKnappert, Jan. 1970. Contribution from the study of loanwords to the cultural history of Africa. In Language and history in Africa, ed. by D. Dalby, pp. 78-88. London: Frank Cass.\n\nKnappert, Jan. 1972/73. The study of loan words in African languages. Afrika und \u00dcbersee 56: 283-308.\n\nKnappert, Jan. 1983. Persian and Turkish loanwords in Swahili. Sprache und Geschichte in Africa 5:111-143.\nKrumm, Bernhard. 1940. Words of oriental origin in Swahili. London: Sheldon Press.\n\nLane, Edward William. 1863-1893. An Arabic-English lexicon. 8 vols. London: Williams & Norgate.\nLangHeinrich, F. 1921. Schambala-W\u00f6rterbuch. Hamburg: L. Friederichsen.\n\nLodhi, Abdulaziz Y. 2000. Oriental influences in Swahili: a study in language and culture contact. G\u00f6teborg: Acta Universatits Gothoburgensis.\n\nMaganga, Clement, and Thilo C. Schadeberg. 1992. Kinyamwezi: grammar, texts, vocabulary. Cologne: R\u00fcdiger K\u00f6ppe Verlag.\n\nNurse, Derek, and Thomas J. Hinnebusch. 1993. Swahili and Sabaki: a linguistic history. Berkeley & Los Angeles: University of California Press.\n\nPlatts, John T. 1884; reprint 1977. A dictionary of Urdu, classical Hindi and English. New Delhi: Oriental Books Reprint Corporation.\n\nSacleux, Ch. 1939. Dictionnaire swahili-fran\u00e7ais. (Travaux et M\u00e9moires de l\u2019Institut d\u2019Ethnologie, 36/37.) Paris: Mus\u00e9e de l\u2019Homme.\n\nSteingass, Franz. 1892. A comprehensive Persian-English dictionary including the Arabic words and phrases to be met with in Persian literature, being Johnson and Richardson's Persian, Arabic and English Dictionary revised, enlarged, and entirely reconstructed. London.\n\nTUKI. 1981. Kamusi ya Kiswahili Sanifu. Dar es Salaam & Nairobi: Oxford University Press.\n\nTUKI.1996. English-Swahili dictionary / Kamusi ya Kiingereza-Kiswahili. Institute of Kiswahili Research, University of Dar es Salaam.\n\nTUKI. 2001. Kamusi ya Kiswahili-Kiingereza / Swahili-English dictionary. Taasisi ya Uchunguzi wa Kiswahili, Chuo Kikuu cha Dar es Salaam.\n\nVelten, Carl. 1910. Suaheli-W\u00f6rterbuch. 1. Teil: Suaheli-Deutsch. Berlin: im Selbstverlag.\n\nVelten, Carl. 1933. Suaheli-W\u00f6rterbuch. 2. Teil: Deutsch- Suaheli. Leipzig: Magliaso for Otto Harrassowitz.\n\nWagenaar, H. W. (comp.), S. S. Parikh (ed.), D. F. Plukker (indologist), and R. F. Veldhuyzen van Zanten (engineer). 1993. Allied Chambers transliterated Hindi-Hindi-English dictionary. New Delhi: Allied Chambers (India).\n\nWilkinson, R. J. 1901-1902. A Malay-English dictionary. 2 parts. Singapore: Kelly and Walsh.\n\nWilkinson, R. J. 1932. A Malay-English dictionary (romanised). 2 vols. Mytilene: Salavopoulos and Kinderlis.\n\nWorms, A. 1898. W\u00f6rterverzeichniss der Sprache von Uzaramo. Zeitschrift f\u00fcr afrikanische und ozeanische Sprachen 4:339-365."", ""abbreviations"": ""The vocabulary provides information about the grammatical status of each Swahili item (field \""Grammatical information\""). Numbers refer to the Swahili (Bantu) noun classes, a slash separates singular/plural classes. \u201cGen\u201d refers to the nominal possessive (also known as \u201cassociative\u201d) construction.\n\nThe following non-standard abbreviations are used:\n\na\tadjective\nAdvP\tadverbial phrase\nconj\tconjunction\nGenP\tgenitival phrase\ninterrog\tinterrogative\ninv\tinvariable (a subcategory of adjectives)\nn\tnoun\nNP\tnoun phrase\nNPx\tnominal prefix\nnum\tnumeral (a subcategory of adjectives and nouns)\nNumP\tnumeral phrase\nPPx\tpronominal prefix\nprep\tpreposition\npro\tpersonal pronoun\nS\tsentence\nTAM\ttime-aspect-mood\nv\tverb\nVP\tverb phrase""}",1,Swahili,,,,1
2,"{""fd_age"": ""Age indications are based on Kie\u00dfling & Mous (2003). What is reconstructable to Proto Iraqwoid level (Iraqw+Gorwa) is indicated as \u2013200; for proto Northern West Rift (Iraqw, Gorwa; Alagwa) as \u2013300 and as proto West-Rift (Iraqw, Gorwa, Alagwa, Burunge) as \u2013500. These dates are very tentative guesses and not based on any external evidence. We have not indicated age beyond the West-Rift period because we do not know yet how the South Cushitic Rift languages fit into the wider (Eastern) Cushitic picture. Colonial is used for the colonial period and recent for the post-colonial period. The distinction is not always easy to make and the division between these two is not rigid. \nSometimes the root is old but there is no information on the age of the specific derivation in the word form; in those cases \u201cAge\u201d is given is \u201cno information\u201d. For example, tiqti \u2018illness\u2019 has \u2018no information\u2019 for its age but it is derived from the root tiq \u2018to be ill\u2019 which can be reconstructed to proto West-Rift level.\n\n-500\tat times of proto West Rift \n-300\tpre-colonial (only 1 item: masomba \u2018youth\u2019)\n-200\tpre-colonial\ncolonial\tcolonial\nrecent\tpost-colonial"", ""fd_form"": ""The basis of the database is Mous, Qorro and Kie\u00dfling (2002). In the summer of 2005 Dr. Martha Qorro (native speaker and linguist from University of Dar es Salaam) and Maarten Mous went through the whole list together and discussed all problematic entries.\nFor the word form field, the Iraqw orthography has been used. This has the following properties: / is a voiced pharyngeal fricative with creaky voice, hh is a voiceless pharyngeal fricative, ' is a glottal stop (not written but present word initially and between different vowels, thus ai is in tact a'i, sl is a voiceless lateral fricative, tl and ts are ejective affricates, the former with lateral release, ng is a velar nasal word-imtially and word-finally and followed by a voiced velar stop between vowels. Double vowels are long, (high) tone is only marked on the first vowel symbol low tone is left unmarked. For verbs we have taken the form of the first person singular which is not a complete form since it needs an additional inflectional word to form a complete sentence. Nouns are often derived for number; sometimes I have taken the underived plural form (and given a plural meaning in W6), sometimes the underived singular form and when all forms are derived, the singular. This is not always reflected in the Analyzability field.\nWe did not provide counterparts for for those LWT labels that we felt would not be used by rural Iraqw speakers. Educated Iraqw speakers might use Swahili words for some of these but most Iraqw speakers would never feel the need to use equivalents of these labels. It was extremely useful to have the viewpoint of a native speaker and linguist on these matters."", ""abbreviations"": ""COLL = collective\nINDEF = indefinite\nN.AG. = Nomen agentis\nSGLTV = singulative\nVBLZ = verbalizer\n\nThe following glosses are used in the Morpheme By Morpheme Gloss: ADJective, APPLicative, CAUSative, COLLective, DEMonstrative, INDEFinite, NMLZ nominalizer, N.AG. Nomen agentis, POSSessive, SGLTV singulative, Q question word marker, VBLZ verbalizer."", ""fd_analyzability"": ""Many noun forms are in fact derived but these are not marked as analyzable. Since most nouns contain a number suffix we have decided not to mark these as analyzed. Also words that contain grammatical morphemes that are reconstructable in that form (with the suffix) are not considered analyzable. However words that contain a wordclass changing derivation and words that warrant a separate entry in the dictionary are given as analyzable. Semi-analyzable was used for those words that contain lexicalised derivations that seemed to be of interest to present."", ""fd_reference"": ""Ehret, Christopher 1980. The Historical Reconstruction of Southern Cushitic Phonology and Vocabulary. Berlin: Dietrich Reimer.\nKie\u00dfling, Roland. 1998. Reconstructing the Sociohistorical Background of the Iraqw Language. Afrika und \u00dcbersee 81:167-225.\nKie\u00dfling, Roland and Maarten Mous 2003. The Lexical Reconstruction of West-Rift Southern Cushitic. Cologne: R\u00fcdiger K\u00f6ppe.\nMous, Maarten, Martha Qorro and Roland Kie\u00dfling. 2002. An Iraqw Dictionary. Cologne: R\u00fcdiger K\u00f6ppe\nVo\u00dfen, Rainer. 1997. Die Khoe-Sprachen. Cologne: R\u00fcdiger K\u00f6ppe."", ""fd_register"": ""There was no need to use W23 (register), W3 (original script), and no possiblity to indicate Frequency (W13)."", ""fd_borrowed"": ""It is quite straightforward to recognise borrowings because Iraqw (Cushitic, Afroasiatic) is in a different language phylum from its major lenders, Swahili (Bantu, Niger Congo) and Datooga (Nilotic, Nilo-Saharan). Borrowed words are nearly always of the category \u201cClearly borrowed\u201d. In one or two cases this is not so clear and for those cases, the reason is given in the database. Thus borrowed status is usually clear.\nThe major donor languages are Swahili and Datooga. Datooga is in fact a collection of dialects but we have not tried to distinguish them. Datooga forms pose a problem anyway because for some words that Iraqw speakers identify as Datooga loans we do not know the Datooga form due to the lack of knowledge about Datooga lexicon."", ""fd_hungarian_translation"": null}",2,Iraqw,,,,1
3,"{""fd_form"": ""Notes on transcription and transliteration:\n(i) Transcription of Gawwada is phonological and follows the IPA conventions, except for the following: <c\u2019> = /t\u0283\u2019/; <\u0161> = /\u0283/; <y> = /j/.\n\n(ii) Transcription of Oromo follows the standard orthography that is in use since the early 1990s (qubee). Forms from Gragg\u2019s (1982) dictionary have been retranscribed accordingly. The main characteristics of the Oromo orthography are: <ph> = /p\u2019/, <x> = /t\u2019/, <ch> = /\u02a7/, <c> = /\u02a7\u2019/, <q> = /k\u2019/.\nNo attempt has been made to make the length of final -a in nouns uniform, due to the current high variation in use.\n\n(iii) Amharic is transliterated from the fidel syllabary according to the Orientalist tradition. In particular, ejectives are marked by a subscript dot (e.g., <\u1e6d> for /t\u2019/), but /k\u2019/ is transcribed <q>. Moreover, the ejective affricate /\u02a7\u2019/ is transcribed here with <\u010d\u2019>. Also following usual practice, the palatal nasal /\u0272/ is transcribed by <\u00f1>. The historical pharyngeals /\u0127/ and /\u0295/, generally retained in the Amharic orthography, are transliterated with <\u1e25> and < \u2018>, respectively (although they have turned into to /h/ and \u00d8, respectively). Finally, the low vowel called \u201cfirst order\u201d in Ethiopian tradition, phonetically mainly [\u0250], is transcribed <\u00e4>, while the central vowel [\u0268] (\u201csixth order\u201d) is transcribed <\u0259>.\n\n(iv) For Konso, the transcription of Black & Shako\u2019s (1973) dictionary is followed.\n\n(v) Words in other languages (English, French, Italian) are given in their respective orthographies."", ""abbreviations"": ""The following abbreviations are used in the morpheme-by-morpheme gloss:\n\nCAUS       Causative\t\nCONN      Connector\t\nDEF          Definite\t\nDENOM   Denominal\t\nDIR           Directional\t\nF\t      Feminine\t\nIMPF\t      Imperfective\t\nIMPV\t      Imperative\t\nINCH\t      Inchoative\t\nINSTR      Instrumental\t\nLINK\t      Linker\t\nLOC\t      Locative\t\nM\t      Masculine\t\nMID\t      Middle\t\t        \nNEG\t      Negative\nP\t      Plural\nPART\t      Partitive\nPASS\t      Passive\nPFV\t      Perfective\nRED\t      Reduplicated\nS\t      Singular\nSEM\t      Semelfactive\nSG\t      Singulative\nSIT     \t      Situative\nSPEC\t      Specific\nVN\t      Verbal Noun\n1\t      First person; First person Subject Clitic\n2         \t      Second person; Second person        Subject Clitic\n3                Third person; Third person Subject Clitic"", ""fd_analyzability"": ""I used the following criteria to determine the analyzability of word forms. \n\n(i) Unanalyzable:\nThis is chosen when no analysis is possible in Gawwada.  This includes:\nA. Monomorphemic words\nB. Basic (underived) verbs: following common practice in Cushitic, verbs are listed under the form of the Imperative Positive Singular, which is itself identical to the bare root plus an accentual/tonal pattern. They are therefore considered here unanalyzable, although they could be glossed \u201cX (= meaning).IMPV.S\u201d\n\n(ii) Semi-analyzable:\nA few words are considered semi-analyzable: they appear to have a root, but also other phonological material (either another root or an apparent affix) whose nature is unknown.\n\n(iii) Analyzable derived:\nAll bi- and pluri-morphemic phonological words are analyzed as derived.\n\n(iv) Analyzable compound:\nMainly genitival phrases, in which the modifier is followed by the Locative caseform (LOC) or in the bare (Absolute) form, are analyzed as compounds.\n\n(v) Analyzable phrasal:\nThis is chosen in two cases:\nA. Meanings which were rendered by the informants with a verbal form preceded by a subject clitic, and, occasionally, other lexical material (such as a subject or an object) are analyzed as phrasal.\nB. Sequences of nouns in which the first is followed by the Linker clitic (LINK) =pa \u201cand\u201d."", ""fd_reference"": ""Amborn, Hermann, Gunter Minker & Hans-J\u00fcrgen Sasse. 1980. Das Dullay. Materialien zu einer \tostkuschitischen Sprachgruppe. Berlin: Dietrich Reimer.\nBlack, Paul & Shako Otto. 1973. Konso dictionary. Ms.\nGragg, Gene B. 1982. Oromo Dictionary. East Lansing, Michigan: African Studies Center, \tMichigan State University.\nGriefenow-Mewis, Catherine & Tamene Bitima. 1994. Lehrbuch des Oromo. K\u00f6ln: R\u00fcdiger \tK\u00f6ppe.\nHinsene Mekuria (1998). Galmee Jechoota Afaan Oromoo-Amaaraa-Inglizii. Finfinnee (Addis \tAbaba).\nLeslau, Wolf. 1976. Concise Amharic Dictionary. Wiesbaden: Harrassowitz.\nLes, Ton, Joseph Van de Loo & George Cotter (1992). An Oromo-English Vocabulary. Debre Zeit \t(Ethiopia)."", ""fd_hungarian_translation"": null}",3,Gawwada,,,,1
